item_id,item_name,type,notes,love,to_listen,connections,connection_labels,connection_directions
1,Robbie Basho - Visions of the Country (1978),album,"2025-01-06. 12-string fingerpicking & piano w intensity, vulnerability. Vibrato-rich mystical vocal. Hypnotic, shimmering [1978, Windham Hill Records]",1,,,,none
2,Robbie Basho,artist,"Folk guitarist, Baltimore, active 1965-1986",,,1|6,made|made,forward|forward
3,Junior Boys,artist,"Electronic duo, Hamilton, Ontario, active 1999-",,,7|8,made|made,forward|forward
4,Jim O'Rourke,artist,"Rock, avant-garde musician, producer, Chicago, active 1989-",1,,6|5,Jim's fave Basho album|made,backward|forward
5,Jim O'Rourke - Insignificance (2001),album,"2025-01-08 (re-listening). Just stunning & first track goes so hard. Glenn Kotche drums. Lyrics occasionally spiritually damaging [2001, Drag City]",,,8,released on Domino (Jim in UK; JB in US),none
6,Robbie Basho - The Falconer's Arm I (1967),album,"2025-01-20. Vast, expressive 12-string & on one track, flute. Often trancelike, evokes Hindustani classical music. Spiritually elevated [1967, Takoma Records]",,,,,
7,Junior Boys - Waiting Game (2022),album,"2025-01-06. Incredibly mellow. Nice synth key, horn timbres. Night Walk like Blue Nile meets Earthbound OST [2022, City Slang]",,,,,
8,Junior Boys - Last Exit (2004),album,"2025-01-08. Cool busy programmed drum grooves. Soft vocal. Subtle, relaxed, comfortable [2004, Domino]",,,,,
9,Horse Jumper of Love,artist,"Rock band, Boston, active 2013-",,,10,made,forward
10,Horse Jumper of Love - Disaster Trick (2024),album,"2025-01-08. Great fuzzy guitar melodies, yearning chord changes. Lyrics sometimes juvenile but in a good way. Recorded in Asheville; Karly & MJ of Wednesday guest [2024, Run for Cover]",,,,,
11,MJ Lenderman,artist,"Rock singer-songwriter, Asheville, NC, active 2018-",,,10|13|17|31,played guitar on|MJ put Forget the Flowers on Spotify playlist|played guitar and sang on|member of,forward|backward|forward|forward
12,Wilco,artist,"Rock band, Chicago, active 1994-",1,,13,made,forward
13,Wilco - Being There (1996),album,"2025-01-09 (re-listening). On some days my favourite album ever. 19 songs all so good. I'D LIKE TO THANK YOU ALL FOR NOTHING [1996, Reprise (Warner Music)]",1,,,,
14,Jeff Tweedy,artist,"Rock singer-songwriter, Belleville, IL, active 1984-",1,,12|5|27|61,member of|played guitar on|produced|member of,forward|forward|forward|forward
15,Sierra Ferrell - Trail of Flowers (2024),album,"2025-01-09. Clean, spacious Nashville production & excellent musicianship. Lots of different styles. Fun [2024, Rounder]",,,,,
16,Sierra Ferrell,artist,"Country singer-songwriter, Charleston, WV, active 2018-",,,15,made,forward
17,Waxahatchee - Tigers Blood (2024),album,To re-listen,,1,15,nominated best song 2024 Americana Music Awards,none
18,Waxahatchee,artist,"Project of Katie Crutchfield, rock singer-songwriter, Birmingham, AL, active 2010-",,,17,made,forward
19,Takeshi Terauchi - Eleki Bushi 1966-1974 (2023 comp),album,"2025-01-10. Had not heard anything quite like this. Japanese scales (& instruments) in heavy hitting surf rock. Shamisen-like guitar. Great remaster job too [2023 comp, 180g]",,,,,
20,Takeshi Terauchi,artist,"Rock guitarist, Tsuchiara, Japan, active 1960-2021",,,19|25,made|both notably recorded Dark Eyes/Les Yeux Noirs,forward|none
21,Wilburn Burchette - Opens the Seven Gates of Transcendental Consciousness (1972),album,"2025-01-12. Passionate, lyrical solo guitar often around drone w plenty echo. Homemade guitar (!) & electronics [1972, Ebos; 2024, Numero Group]",,,,,
22,Wilburn Burchette,artist,"Guitarist & 'mail-order mystic', California, active 1971-1977",,,21,made,forward
23,The Weather Station - Humanhood (2025),album,"2025-01-17. V clean, spacious, texturally engaging. Elegant production & orchestration. Almost Joni-like vocal. Approachable [2025, Fat Possum]",,,,,
24,The Weather Station,artist,"Rock/folk band led by Tamara Lindeman, Toronto, active 2006-",,,23,made,forward
25,Django Reinhardt,artist,"Belgian-French jazz guitarist, active 1928-1953",,,,,
26,Richard Thompson,artist,"Folk rock singer-songwriter, London, active 1967-",,,27|44,made|made,forward|forward
27,Richard Thompson - Still (2015),album,To listen,,1,25,last track on Still includes tribute to Django,none
28,Soccer Mommy,artist,"Rock/pop singer-songwriter, Nashville, active 2015-",,,12|29,sang Pot Kettle Black together live in 2022|made,none|forward
29,Soccer Mommy - Clean (2018),album,"2025-03-05 (re-listening). Classic SM; maybe my fave of hers so far. Production natural & fun. Lyrics gloomy & solipsistic. Love it [2018, Fat Possum]",,,23,released on Fat Possum,none
30,Unwound - Unwound (1995),album,"2023-03-25. The 1st recorded (in 1992) but 4th released of 7 Unwound albums. Possibly the least appreciated thereof. Rougher edges & higher energy than later stuff. Same mad riffs. V short. Signs of things to come in the shimmering foreboding Fingertips & v Sonic Youth-like Stuck in the Middle of Nowhere [1995, Honey Bear; 2013, Numero Group]",,,21,reissued on Numero,none
31,Wednesday,artist,,1,,30,Karly put several songs from Unwound s/t on Spotify playlist,backward
32,Unwound,artist,"Rock band, Tumwater/Olympia, WA, active 1988-2002, 2022-",,,30,made,forward
33,FKA twigs - Eusexua (2025),album,"2025-02-01. Adventurous techno/Bjork-like pop. Lots of cool twists & turns. Like a less humourous Pop 2 [2025, Young]",,,,,
34,FKA twigs,artist,"Pop singer-songwriter, Cheltenham, Glos., active 2004-",,,33,made,forward
35,Cameron Winter - Heavy Metal (2025),album,"2025-02-04. Amazing instrumentation: nylon strings, Casios, loads of percussion, more, blended into something original. Vocals like Adam Green meets Cleveland from Family Guy. Love Takes Miles rules [2025, Partisan]",,,,,
36,Cameron Winter,artist,"Rock, folk singer-songwriter, New York, active 2016-",,,35,made,forward
37,Bonnie Prince Billy - The Purple Bird (2025),album,"2025-02-20. More country than other BPB I've heard (nice). Good mix of sincerity and humour, light and dark. Wish he didn't sing about skinny dipping etc. [2025, No Quarter]",,,,,
38,"Bonnie ""Prince"" Billy",artist,"Rock/country singer-songwriter, Louisville, KY, active 1993-",,,37|43,made|made,forward|forward
39,Leonard Cohen - Songs of Leonard Cohen (1967),album,To re-listen,,1,35,Winter says listened to every day while making Heavy Metal,forward
40,Leonard Cohen,artist,"Folk/rock singer-songwriter, Montreal, active (in music) 1966-2016",,,39|41,made|made,forward|forward
41,Leonard Cohen - Songs of Love and Hate (1971),album,To re-listen,,1,28,SM cites Famous Blue Raincoat as fave LC song,forward
42,Tortoise,artist,"Post-rock band, Chicago, active 1990-",,,43,made,forward
43,"Tortoise and Bonnie ""Prince"" Billy - The Brave and the Bold (2006)",album,To listen,,1,,,
44,Richard and Linda Thompson - I Want to See the Bright Lights Tonight (1974),album,To listen,,1,43,none,Tortoise & BPB cover Calvary Cross
45,Linda Thompson,artist,"Folk/rock singer-songwriter, London, active 1966-",,,44,made,forward
46,Atoris,artist,"Ambient/new age trio, Tokyo, active 2019-",,,47,made,forward
47,Atoris - Sea & Forest (2022),album,"2025-02-27. Very pleasant repeating, drifting electronic textures & motifs. Like walking through the park on a misty day. Straight to the study playlist [2022, Moon Glyph]",,,,,
48,Lia Kohl,artist,"Cellist/composer/sound artist, Chicago, active 2019?-",,,50|51,made|made,forward|forward
49,Whitney Johnson,artist,"Experimental composer/improviser, Chicago, active 2013?-",,,50,made,forward
50,Whitney Johnson & Lia Kohl - For Translucence (2025),album,To listen,,1,5,on Drag City & from Chicago,both
51,Lia Kohl - Normal Sounds (2024),album,"2025-02-28. Delightful twists and turns. Cello, humming/buzzing/urban sounds, cave/splashy percussion drifts in and out. Sometimes less drift more click. Strangely comforting without ever being dull [2024, Moon Glyph]",1,,47,on Moon Glyph,both
52,FKA Twigs - LP1 (2014),album,To listen,,1,34,made,backward
53,Arca,artist,"Singer, producer, Caracas, Venezuela, active 2012-",,,52,produced some tracks,forward
54,Björk,artist,"Singer/songwriter/composer, Reykjavik, Iceland, active 1977-",,,55,made,forward
55,Björk - Utopia (2017),album,To listen,,1,53,"producer, co-wrote much of",backward
56,Dirty Projectors,artist,"Rock band, Brooklyn, active 2002-",,,,,
57,Björk & Dirty Projectors - Mount Wittenberg Orca (2010),album,To re-listen,,1,54|56,made|made,backward|backward
58,Dirty Projectors - Rise Above (2007),album,To re-listen,,1,56,made,backward
59,Black Flag,artist,"Punk band, Hermosa Beach, CA, active 1976-sort of present",,,60|32,made|Ginn major influence for Justin Trosper,forward|forward
60,Black Flag - Damaged (1980),album,To re-listen,,1,58,re-interpretation of,forward
61,Uncle Tupelo,artist,"Country rock band, Belleville, IL, active 1987-1994",,,60,UT covered Gimme Gimme Gimme,backward
62,Ichiko Aoba - Luminescent Creatures (2025),album,"2025-03-05. Stunning Bacharach/Wilson-like chord changes. String arrangements to die for. More instruments, more production value compared earlier releases [2025, hermine]",,,,,
63,Ichiko Aoba,artist,"Folk singer-songwriter, Kyoto Prefecture, active 2010-",,,62,made,forward
64,Lynn Avery & Cole Pulice - Phantasy & Reality (2024),album,"2025-03-25. Gentle piano, sax, electronics. Beautiful soft textures. Like wandering a vast plain in a video game [2024, Moon Glyph]",,,51|47,on Moon Glyph|on Moon Glyph,both|both
65,Lynn Avery & Cole Pulice,artist,"Ambient/jazz duo, Minneapolis, MN, later Oakland, CA, active 2022?-",,,64,made,forward
66,Eli Winter,artist,"Folk/jazz guitarist, Chicago, active 2014?-",,,67,made,forward
67,Eli Winter - A Trick of the Light (2025),album,"2025-05-20. Endearing mix of rustic guitar-forward jazz and sort of instrumental country. Gets way more basic as it progresses. Pedal steel empire continues to expand [2025, Three Lobed Recordings]",,,,,
68,Ayane Shino,artist,"Classical guitarist, based in Tokyo, active 20210?-",,,69,made,forward
69,Ayane Shino - River (2025),album,"2025-05-21. Very moving, sometimes playful layered classical guitar pieces. Arrangements of compositions by Hiroshima producer Rei Harakami who passed away in 2011 [2025, musicmine]",,,,,
70,Trembling Blue Stars,artist,"Pop/electronic project, London, active 1996-2010",,,71,made,forward
71,Trembling Blue Stars - Lips that Taste of Tears (1998),album,"2026-02-08. Listening after Shazaming The Rainbow. Lyrics from perspective of creepiest ex ever. Run as fast as you can. Zero self awareness. The Rainbow is a banger though [1998, Shinkansen]",,,,,
72,Erika de Casier,artist,"Pop/R&B singer/songwriter, based in Copenhagen, active 2014-",,,73,made,forward
73,Erika de Casier - Lifetime (2025),album,"2026-02-08. Actually listened to it a lot last year. Underrated trip hop masterpiece. Wise. A cool breeze [2025, Independent Jeep]",1,,,,